{"$comment":"Codestra Connector SDK v1; SemVer 2.0.0, disabled-first, secret-reference-only, canonical HTTPS runtime origin.","$defs":{"command":{"additionalProperties":false,"properties":{"prefix":{"pattern":"^[a-z0-9]+(?:[.-][a-z0-9]+)*\\.$","type":"string"},"readback_required":{"type":"boolean"},"required_capability":{"pattern":"^(?:NONE|[A-Z][A-Z0-9_]*)$","type":"string"},"retry_policy":{"$ref":"#/$defs/retryPolicy"},"timeout_seconds":{"maximum":300,"minimum":1,"type":"integer"}},"required":["prefix","required_capability","timeout_seconds","readback_required","retry_policy"],"type":"object"},"event":{"additionalProperties":false,"properties":{"direction":{"enum":["inbound","outbound"]},"event_type":{"pattern":"^[a-z0-9]+(?:[.-][a-z0-9]+)*\\.v[1-9][0-9]*$","type":"string"}},"required":["event_type","direction"],"type":"object"},"retryPolicy":{"additionalProperties":false,"properties":{"initial_backoff_seconds":{"maximum":3600,"minimum":0,"type":"number"},"jitter_ratio":{"maximum":1,"minimum":0,"type":"number"},"maximum_attempts":{"maximum":20,"minimum":1,"type":"integer"},"maximum_backoff_seconds":{"maximum":86400,"minimum":0,"type":"number"},"unknown_outcome_requires_readback":{"const":true}},"required":["maximum_attempts","initial_backoff_seconds","maximum_backoff_seconds","jitter_ratio","unknown_outcome_requires_readback"],"type":"object"},"webhook":{"additionalProperties":false,"properties":{"acknowledgement_deadline_seconds":{"maximum":30,"minimum":1,"type":"integer"},"endpoint_key":{"pattern":"^[a-z0-9]+(?:-[a-z0-9]+)*$","type":"string"},"event_id_header":{"pattern":"^[!#$%&'*+\\-.^_`|~0-9A-Za-z]{1,100}$","type":"string"},"maximum_body_bytes":{"maximum":10485760,"minimum":1,"type":"integer"},"maximum_clock_skew_seconds":{"maximum":900,"minimum":30,"type":"integer"},"route_path":{"pattern":"^/(?:v1/webhooks|internal/v1/adapters)/[A-Za-z0-9._~!$&'()*+,;=:@/-]+$","type":"string"},"secret_reference":{"pattern":"^[A-Z][A-Z0-9_]{2,127}$","type":"string"},"signature_algorithm":{"const":"hmac-sha256"},"signature_header":{"pattern":"^[!#$%&'*+\\-.^_`|~0-9A-Za-z]{1,100}$","type":"string"},"timestamp_header":{"pattern":"^[!#$%&'*+\\-.^_`|~0-9A-Za-z]{1,100}$","type":"string"}},"required":["endpoint_key","route_path","signature_algorithm","signature_header","timestamp_header","event_id_header","maximum_clock_skew_seconds","maximum_body_bytes","acknowledgement_deadline_seconds","secret_reference"],"type":"object"}},"$id":"https://contracts.codestra.co/connectors/connector-manifest.v1.schema.json","$schema":"https://json-schema.org/draft/2020-12/schema","additionalProperties":false,"properties":{"$schema":{"format":"uri","type":"string"},"authentication":{"additionalProperties":false,"properties":{"audience":{"maxLength":200,"minLength":1,"pattern":"^[A-Za-z0-9._:/-]+$","type":"string"},"scopes":{"items":{"maxLength":160,"pattern":"^[a-z0-9]+(?:[.:-][a-z0-9-]+)*$","type":"string"},"minItems":1,"type":"array","uniqueItems":true},"secret_references":{"items":{"pattern":"^[A-Z][A-Z0-9_]{2,127}$","type":"string"},"minItems":1,"type":"array","uniqueItems":true},"type":{"enum":["oauth2-client-credentials","mtls","oauth2-plus-mtls"]}},"required":["type","audience","scopes","secret_references"],"type":"object"},"cell":{"enum":["core-communications","beyvra-financial","telephony-private"]},"commands":{"items":{"$ref":"#/$defs/command"},"minItems":1,"type":"array"},"connector_id":{"pattern":"^[a-z0-9]+(?:-[a-z0-9]+)*$","type":"string"},"direct_n8n_access":{"const":false},"display_name":{"maxLength":120,"minLength":1,"type":"string"},"enabled_by_default":{"const":false},"events":{"items":{"$ref":"#/$defs/event"},"type":"array"},"forbidden_command_prefixes":{"items":{"pattern":"^[a-z0-9]+(?:[.-][a-z0-9]+)*\\.$","type":"string"},"type":"array","uniqueItems":true},"forbidden_payload_keys":{"items":{"maxLength":100,"minLength":1,"type":"string"},"minItems":6,"type":"array","uniqueItems":true},"manifest_version":{"const":"1.0"},"metadata":{"type":"object"},"repository":{"pattern":"^[A-Za-z0-9_.-]+/[A-Za-z0-9_.-]+$","type":"string"},"runtime_binding":{"additionalProperties":false,"properties":{"base_url":{"format":"uri","type":"string"},"health_path":{"pattern":"^/(?!/)[A-Za-z0-9._~!$&'()*+,;=:@/-]+$","type":"string"},"operation_path_template":{"pattern":"^/(?!/)[A-Za-z0-9._~!$&'()*+,;=:@/-]*/?\\{operation_id\\}[A-Za-z0-9._~!$&'()*+,;=:@/-]*$","type":"string"},"status":{"enum":["UNVERIFIED_TEMPLATE_ONLY","VERIFIED"]}},"required":["status","base_url","health_path","operation_path_template"],"type":"object"},"version":{"pattern":"^(0|[1-9][0-9]*)\\.(0|[1-9][0-9]*)\\.(0|[1-9][0-9]*)(?:-[0-9A-Za-z.-]+)?(?:\\+[0-9A-Za-z.-]+)?$","type":"string"},"webhooks":{"items":{"$ref":"#/$defs/webhook"},"type":"array"},"workflow_families":{"items":{"pattern":"^[a-z0-9]+(?:[.-][a-z0-9]+)*$","type":"string"},"minItems":1,"type":"array","uniqueItems":true}},"required":["manifest_version","connector_id","display_name","version","cell","repository","enabled_by_default","direct_n8n_access","runtime_binding","authentication","commands","events","webhooks","forbidden_command_prefixes","forbidden_payload_keys","workflow_families"],"title":"Codestra Connector Manifest v1","type":"object"}
