{"$schema":"https://contracts.codestra.co/connectors/connector-manifest.v1.schema.json","manifest_version":"1.0","connector_id":"klyrow-email","display_name":"Klyrow Email","version":"1.0.0","cell":"core-communications","repository":"appolon1908/klyrow.com","enabled_by_default":false,"direct_n8n_access":false,"runtime_binding":{"status":"UNVERIFIED_TEMPLATE_ONLY","base_url":"https://klyrow.internal.invalid","health_path":"/health","operation_path_template":"/v1/operations/{operation_id}/status"},"authentication":{"type":"oauth2-plus-mtls","audience":"codestra-middleware-api","scopes":["connector.klyrow-email.command","connector.klyrow-email.read"],"secret_references":["CONNECTOR_KLYROW_EMAIL_CLIENT_SECRET","CONNECTOR_KLYROW_EMAIL_MTLS_CERT"]},"commands":[{"prefix":"email.","required_capability":"EMAIL_DELIVERY","timeout_seconds":30,"readback_required":true,"retry_policy":{"maximum_attempts":5,"initial_backoff_seconds":2,"maximum_backoff_seconds":120,"jitter_ratio":0.2,"unknown_outcome_requires_readback":true}}],"events":[{"event_type":"email.message.delivered.v1","direction":"inbound"},{"event_type":"email.message.bounced.v1","direction":"inbound"},{"event_type":"email.message.complained.v1","direction":"inbound"},{"event_type":"email.message.unsubscribed.v1","direction":"inbound"},{"event_type":"email.inbound.received.v1","direction":"inbound"}],"webhooks":[{"endpoint_key":"postal-events","route_path":"/v1/webhooks/email/postal","signature_algorithm":"hmac-sha256","signature_header":"X-Postal-Signature","timestamp_header":"X-Postal-Timestamp","event_id_header":"X-Postal-Event-Id","maximum_clock_skew_seconds":300,"maximum_body_bytes":1048576,"acknowledgement_deadline_seconds":5,"secret_reference":"WEBHOOK_POSTAL_HMAC_SECRET"}],"forbidden_command_prefixes":[],"forbidden_payload_keys":["access_token","client_secret","password","private_key","provider_token","refresh_token"],"workflow_families":["messaging.klyrow"],"metadata":{"source_only":true,"runtime_activation_authorized":false,"owner":"klyrow-email"}}
