{"$schema":"https://contracts.codestra.co/connectors/connector-manifest.v1.schema.json","manifest_version":"1.0","connector_id":"kyqra-crawler","display_name":"Kyqra Crawler","version":"1.0.0","cell":"core-communications","repository":"appolon1908/kyqra-crawler","enabled_by_default":false,"direct_n8n_access":false,"runtime_binding":{"status":"UNVERIFIED_TEMPLATE_ONLY","base_url":"https://kyqra.internal.invalid","health_path":"/health","operation_path_template":"/v1/operations/{operation_id}/status"},"authentication":{"type":"oauth2-plus-mtls","audience":"codestra-middleware-api","scopes":["connector.kyqra-crawler.command","connector.kyqra-crawler.read"],"secret_references":["CONNECTOR_KYQRA_CRAWLER_CLIENT_SECRET","CONNECTOR_KYQRA_CRAWLER_MTLS_CERT"]},"commands":[{"prefix":"crawler.","required_capability":"CRAWLER_EXECUTION","timeout_seconds":30,"readback_required":true,"retry_policy":{"maximum_attempts":5,"initial_backoff_seconds":2,"maximum_backoff_seconds":120,"jitter_ratio":0.2,"unknown_outcome_requires_readback":true}}],"events":[{"event_type":"crawler.job.completed.v1","direction":"inbound"},{"event_type":"crawler.job.failed.v1","direction":"inbound"},{"event_type":"crawler.result.review-required.v1","direction":"inbound"}],"webhooks":[{"endpoint_key":"crawler-events","route_path":"/v1/webhooks/crawler/kyqra","signature_algorithm":"hmac-sha256","signature_header":"X-Kyqra-Signature","timestamp_header":"X-Kyqra-Timestamp","event_id_header":"X-Kyqra-Event-Id","maximum_clock_skew_seconds":300,"maximum_body_bytes":1048576,"acknowledgement_deadline_seconds":5,"secret_reference":"WEBHOOK_KYQRA_HMAC_SECRET"}],"forbidden_command_prefixes":[],"forbidden_payload_keys":["access_token","client_secret","password","private_key","provider_token","refresh_token"],"workflow_families":["crawler.kyqra"],"metadata":{"source_only":true,"runtime_activation_authorized":false,"owner":"kyqra-crawler"}}
