{"$schema":"https://contracts.codestra.co/connectors/connector-manifest.v1.schema.json","manifest_version":"1.0","connector_id":"beyvra-nonfinancial","display_name":"Beyvra Nonfinancial Operations","version":"1.0.0","cell":"beyvra-financial","repository":"appolon1908/beyvra-backend","enabled_by_default":false,"direct_n8n_access":false,"runtime_binding":{"status":"UNVERIFIED_TEMPLATE_ONLY","base_url":"https://beyvra-operations.internal.invalid","health_path":"/health","operation_path_template":"/v1/operations/{operation_id}/status"},"authentication":{"type":"oauth2-plus-mtls","audience":"codestra-middleware-api","scopes":["connector.beyvra-nonfinancial.command","connector.beyvra-nonfinancial.read"],"secret_references":["CONNECTOR_BEYVRA_NONFINANCIAL_CLIENT_SECRET","CONNECTOR_BEYVRA_NONFINANCIAL_MTLS_CERT"]},"commands":[{"prefix":"beyvra.operations.","required_capability":"BEYVRA_OPERATIONS_WRITE","timeout_seconds":30,"readback_required":true,"retry_policy":{"maximum_attempts":5,"initial_backoff_seconds":2,"maximum_backoff_seconds":120,"jitter_ratio":0.2,"unknown_outcome_requires_readback":true}}],"events":[{"event_type":"beyvra.operations.report-ready.v1","direction":"inbound"},{"event_type":"beyvra.operations.support-escalated.v1","direction":"inbound"},{"event_type":"beyvra.operations.security-alerted.v1","direction":"inbound"}],"webhooks":[{"endpoint_key":"operations-events","route_path":"/internal/v1/adapters/beyvra/events","signature_algorithm":"hmac-sha256","signature_header":"X-Beyvra-Signature","timestamp_header":"X-Beyvra-Timestamp","event_id_header":"X-Beyvra-Event-Id","maximum_clock_skew_seconds":300,"maximum_body_bytes":1048576,"acknowledgement_deadline_seconds":5,"secret_reference":"WEBHOOK_BEYVRA_HMAC_SECRET"}],"forbidden_command_prefixes":["trade.","order.","wallet.","ledger.","hold.","payment.","withdrawal.","deposit.","transfer.","custody.","chain.","broker.","provider."],"forbidden_payload_keys":["access_token","client_secret","password","private_key","provider_token","refresh_token"],"workflow_families":["product.beyvra-nonfinancial"],"metadata":{"source_only":true,"runtime_activation_authorized":false,"owner":"beyvra-nonfinancial"}}
