{"$schema":"https://contracts.codestra.co/connectors/connector-manifest.v1.schema.json","manifest_version":"1.0","connector_id":"evolution-whatsapp","display_name":"Codestra Evolution WhatsApp","version":"0.1.0","cell":"core-communications","repository":"ingtrader21-spec/Evolution-API","enabled_by_default":false,"direct_n8n_access":false,"runtime_binding":{"status":"UNVERIFIED_TEMPLATE_ONLY","base_url":"https://evolution-whatsapp.internal.invalid","health_path":"/healthz","operation_path_template":"/internal/v1/whatsapp/transport/messages/{operation_id}"},"authentication":{"type":"oauth2-client-credentials","audience":"evolution-whatsapp-adapter","scopes":["whatsapp.send","whatsapp.status.read"],"secret_references":["CONNECTOR_EVOLUTION_WHATSAPP_CLIENT_SECRET"]},"commands":[{"prefix":"whatsapp.","required_capability":"WHATSAPP_DELIVERY","timeout_seconds":30,"readback_required":true,"retry_policy":{"maximum_attempts":5,"initial_backoff_seconds":2,"maximum_backoff_seconds":120,"jitter_ratio":0.2,"unknown_outcome_requires_readback":true}}],"events":[{"event_type":"whatsapp.message.received.v1","direction":"inbound"},{"event_type":"whatsapp.message.delivered.v1","direction":"inbound"},{"event_type":"whatsapp.message.read.v1","direction":"inbound"},{"event_type":"whatsapp.message.failed.v1","direction":"inbound"}],"webhooks":[],"forbidden_command_prefixes":[],"forbidden_payload_keys":["access_token","client_secret","password","private_key","provider_token","refresh_token"],"workflow_families":["messaging.whatsapp"],"metadata":{"source_only":true,"runtime_activation_authorized":false,"middleware_v3_command_authority":true,"provider_effects_default":false}}
