{"$schema":"https://contracts.codestra.co/connectors/connector-manifest.v1.schema.json","manifest_version":"1.0","connector_id":"vicidial-restricted","display_name":"VICIdial Restricted Adapter","version":"1.1.0","cell":"telephony-private","repository":"appolon1908/Vicidialer-Codestra","enabled_by_default":false,"direct_n8n_access":false,"runtime_binding":{"status":"UNVERIFIED_TEMPLATE_ONLY","base_url":"https://vicidial-adapter.internal.invalid","health_path":"/health","operation_path_template":"/v1/operations/{operation_id}/status"},"authentication":{"type":"oauth2-plus-mtls","audience":"codestra-middleware-api","scopes":["connector.vicidial-restricted.command","connector.vicidial-restricted.read"],"secret_references":["CONNECTOR_VICIDIAL_RESTRICTED_CLIENT_SECRET","CONNECTOR_VICIDIAL_RESTRICTED_MTLS_CERT"]},"commands":[{"prefix":"telephony.","required_capability":"PRODUCTION_DIALING","timeout_seconds":30,"readback_required":true,"retry_policy":{"maximum_attempts":5,"initial_backoff_seconds":2,"maximum_backoff_seconds":120,"jitter_ratio":0.2,"unknown_outcome_requires_readback":true}},{"prefix":"telephony-internal.","required_capability":"INTERNAL_TELEPHONY_CALLS","timeout_seconds":30,"readback_required":true,"retry_policy":{"maximum_attempts":1,"initial_backoff_seconds":2,"maximum_backoff_seconds":120,"jitter_ratio":0.2,"unknown_outcome_requires_readback":true}}],"events":[{"event_type":"telephony.call.completed.v1","direction":"inbound"},{"event_type":"telephony.call.missed.v1","direction":"inbound"},{"event_type":"telephony.agent.status-changed.v1","direction":"inbound"}],"webhooks":[{"endpoint_key":"vicidial-events","route_path":"/internal/v1/adapters/vicidial/events","signature_algorithm":"hmac-sha256","signature_header":"X-Vicidial-Signature","timestamp_header":"X-Vicidial-Timestamp","event_id_header":"X-Vicidial-Event-Id","maximum_clock_skew_seconds":300,"maximum_body_bytes":1048576,"acknowledgement_deadline_seconds":5,"secret_reference":"WEBHOOK_VICIDIAL_HMAC_SECRET"}],"forbidden_command_prefixes":[],"forbidden_payload_keys":["access_token","client_secret","password","private_key","provider_token","refresh_token"],"workflow_families":["telephony.contact-center"],"metadata":{"source_only":true,"runtime_activation_authorized":false,"owner":"vicidial-restricted"}}
