{"$schema":"https://contracts.codestra.co/connectors/connector-manifest.v1.schema.json","manifest_version":"1.0","connector_id":"provisioning-service","display_name":"Codestra Provisioning Service","version":"1.0.0","cell":"core-communications","repository":"appolon1908/codestra-provisioning-service","enabled_by_default":false,"direct_n8n_access":false,"runtime_binding":{"status":"UNVERIFIED_TEMPLATE_ONLY","base_url":"https://provisioning.internal.invalid","health_path":"/health","operation_path_template":"/v1/operations/{operation_id}/status"},"authentication":{"type":"oauth2-plus-mtls","audience":"codestra-middleware-api","scopes":["connector.provisioning-service.command","connector.provisioning-service.read"],"secret_references":["CONNECTOR_PROVISIONING_SERVICE_CLIENT_SECRET","CONNECTOR_PROVISIONING_SERVICE_MTLS_CERT"]},"commands":[{"prefix":"provisioning.","required_capability":"PROVISIONING_WRITE","timeout_seconds":30,"readback_required":true,"retry_policy":{"maximum_attempts":5,"initial_backoff_seconds":2,"maximum_backoff_seconds":120,"jitter_ratio":0.2,"unknown_outcome_requires_readback":true}}],"events":[{"event_type":"provisioning.operation.progressed.v1","direction":"inbound"},{"event_type":"provisioning.operation.completed.v1","direction":"inbound"},{"event_type":"provisioning.operation.failed.v1","direction":"inbound"}],"webhooks":[{"endpoint_key":"provisioning-events","route_path":"/internal/v1/adapters/provisioning/events","signature_algorithm":"hmac-sha256","signature_header":"X-Provisioning-Signature","timestamp_header":"X-Provisioning-Timestamp","event_id_header":"X-Provisioning-Event-Id","maximum_clock_skew_seconds":300,"maximum_body_bytes":1048576,"acknowledgement_deadline_seconds":5,"secret_reference":"WEBHOOK_PROVISIONING_HMAC_SECRET"}],"forbidden_command_prefixes":[],"forbidden_payload_keys":["access_token","client_secret","password","private_key","provider_token","refresh_token"],"workflow_families":["identity.provisioning"],"metadata":{"source_only":true,"runtime_activation_authorized":false,"owner":"provisioning-service"}}
