{"$schema":"https://contracts.codestra.co/connectors/connector-manifest.v1.schema.json","manifest_version":"1.0","connector_id":"klyrow-alert-email","display_name":"Klyrow Observability Alert Email","version":"1.0.0","cell":"core-communications","repository":"appolon1908/klyrow.com","enabled_by_default":false,"direct_n8n_access":false,"runtime_binding":{"status":"UNVERIFIED_TEMPLATE_ONLY","base_url":"https://klyrow-alert.internal.invalid","health_path":"/health","operation_path_template":"/v1/email/messages/{operation_id}"},"authentication":{"type":"oauth2-plus-mtls","audience":"klyrow-email","scopes":["email.message.read","email.message.send"],"secret_references":["KLYROW_ALERT_MTLS_CERT","KLYROW_ALERT_MTLS_KEY","KLYROW_ALERT_OIDC_CLIENT_SECRET"]},"commands":[{"prefix":"observability.alert.","required_capability":"OBSERVABILITY_ALERT_EMAIL_DELIVERY","timeout_seconds":30,"readback_required":true,"retry_policy":{"maximum_attempts":1,"initial_backoff_seconds":2,"maximum_backoff_seconds":30,"jitter_ratio":0.2,"unknown_outcome_requires_readback":true}}],"events":[{"event_type":"observability.alert.delivery.v1","direction":"inbound"}],"webhooks":[],"forbidden_command_prefixes":["email.campaign.","email.customer.","email.marketing."],"forbidden_payload_keys":["access_token","client_secret","password","private_key","provider_token","refresh_token"],"workflow_families":["observability.alerts"],"metadata":{"source_only":true,"runtime_activation_authorized":false,"owner":"codestra-observability","recipient_policy_id":"codestra-observability-admin-v1","sender_policy_id":"codestra-alert-sender-v1"}}
