{"$schema":"https://contracts.codestra.co/connectors/connector-manifest.v1.schema.json","manifest_version":"1.0","connector_id":"postly-social","display_name":"Postly Social","version":"1.0.0","cell":"core-communications","repository":"appolon1908/social.codestra.co","enabled_by_default":false,"direct_n8n_access":false,"runtime_binding":{"status":"UNVERIFIED_TEMPLATE_ONLY","base_url":"https://postly.internal.invalid","health_path":"/health","operation_path_template":"/v1/operations/{operation_id}/status"},"authentication":{"type":"oauth2-plus-mtls","audience":"codestra-middleware-api","scopes":["connector.postly-social.command","connector.postly-social.read"],"secret_references":["CONNECTOR_POSTLY_SOCIAL_CLIENT_SECRET","CONNECTOR_POSTLY_SOCIAL_MTLS_CERT"]},"commands":[{"prefix":"social.","required_capability":"SOCIAL_PUBLISH","timeout_seconds":30,"readback_required":true,"retry_policy":{"maximum_attempts":5,"initial_backoff_seconds":2,"maximum_backoff_seconds":120,"jitter_ratio":0.2,"unknown_outcome_requires_readback":true}}],"events":[{"event_type":"social.publication.completed.v1","direction":"inbound"},{"event_type":"social.publication.failed.v1","direction":"inbound"},{"event_type":"social.engagement.received.v1","direction":"inbound"}],"webhooks":[{"endpoint_key":"provider-events","route_path":"/v1/webhooks/social/postly","signature_algorithm":"hmac-sha256","signature_header":"X-Postly-Signature","timestamp_header":"X-Postly-Timestamp","event_id_header":"X-Postly-Event-Id","maximum_clock_skew_seconds":300,"maximum_body_bytes":1048576,"acknowledgement_deadline_seconds":5,"secret_reference":"WEBHOOK_POSTLY_HMAC_SECRET"}],"forbidden_command_prefixes":[],"forbidden_payload_keys":["access_token","client_secret","password","private_key","provider_token","refresh_token"],"workflow_families":["social.postly"],"metadata":{"source_only":true,"runtime_activation_authorized":false,"owner":"postly-social"}}
